<?xml version="1.0" encoding="UTF-8"?>
<?xml-stylesheet type="text/xsl" href="security.xsl"?>
<Security xmlns:xsi="http://www.w3.org/2001/XMLSchema-instance" xsi:noNamespaceSchemaLocation="Security.xsd">
   <SecurityPersonnel>
      <Name>Renil</Name>
      <Age>22</Age>
      <Salary>20000</Salary>
      <YearsOfExperience>3</YearsOfExperience>
   </SecurityPersonnel>
   <SecurityPersonnel>
      <Name>Michael</Name>
      <Age>25</Age>
      <Salary>90000</Salary>
      <YearsOfExperience>9</YearsOfExperience>
   </SecurityPersonnel>
   <SecurityPersonnel>
      <Name>Jim</Name>
      <Age>32</Age>
      <Salary>26000</Salary>
      <YearsOfExperience>2</YearsOfExperience>
   </SecurityPersonnel>
   <SecurityPersonnel>
      <Name>Pam</Name>
      <Age>31</Age>
      <Salary>20000</Salary>
      <YearsOfExperience>2</YearsOfExperience>
   </SecurityPersonnel>
   <SecurityPersonnel>
      <Name>Steve</Name>
      <Age>22</Age>
      <Salary>20000</Salary>
      <YearsOfExperience>3</YearsOfExperience>
   </SecurityPersonnel>
   <SecurityPersonnel>
      <Name>Rithul</Name>
      <Age>52</Age>
      <Salary>35000</Salary>
      <YearsOfExperience>5</YearsOfExperience>
   </SecurityPersonnel>
   <SecurityPersonnel>
      <Name>Lull</Name>
      <Age>22</Age>
      <Salary>20000</Salary>
      <YearsOfExperience>3</YearsOfExperience>
   </SecurityPersonnel>
   <SecurityAgency>
      <AgencyName>Marks Agency</AgencyName>
      <AgencyID>25</AgencyID>
   </SecurityAgency>
   <SecurityAgency>
      <AgencyName>Stacy Agency</AgencyName>
      <AgencyID>76</AgencyID>
   </SecurityAgency>
   <SecurityEquipment>
      <EquipmentName>Armor C77</EquipmentName>
      <EquipmentType>Armor</EquipmentType>
      <EquipmentID>424</EquipmentID>
   </SecurityEquipment>
   <SecurityEquipment>
      <EquipmentName>MSF Rifle</EquipmentName>
      <EquipmentType>Weapon</EquipmentType>
      <EquipmentID>977</EquipmentID>
   </SecurityEquipment>
   <BaggageScanning>
      <BaggageName>Skybag</BaggageName>
      <BaggageID>24523</BaggageID>
   </BaggageScanning>
   <SecurityScreening>
      <GateFloorNumber>5</GateFloorNumber>
      <GateID>1363</GateID>
   </SecurityScreening>
   <CCTVCameras>
      <CameraFloor>2</CameraFloor>
      <CameraNumber>66462</CameraNumber>
   </CCTVCameras>
   <CCTVCameras>
      <CameraFloor>4</CameraFloor>
      <CameraNumber>22262</CameraNumber>
   </CCTVCameras>
   <CCTVCameras>
      <CameraFloor>5</CameraFloor>
      <CameraNumber>78862</CameraNumber>
   </CCTVCameras>
   <MallAdmin>
      <AdminName>Renil Justin</AdminName>
      <AdminID>5632323</AdminID>
   </MallAdmin>
</Security>